{
  "$schema": "https://json-schema.org/draft/2020-12/schema",
  "type": "object",
  "additionalProperties": false,
  "required": ["status", "source", "summary", "stages", "findings", "disclosure"],
  "properties": {
    "status": {
      "enum": [
        "not_reviewed",
        "reviewing",
        "preliminary",
        "approved",
        "changes_requested",
        "comment",
        "incomplete"
      ]
    },
    "source": {
      "type": "object",
      "additionalProperties": false,
      "required": ["head_sha", "base_ref"],
      "properties": {
        "head_sha": { "type": "string", "pattern": "^[0-9a-f]{40}$" },
        "base_ref": { "type": "string", "minLength": 1 },
        "merge_base_sha": { "type": "string", "pattern": "^[0-9a-f]{40}$" },
        "inventory_id": { "type": "string", "pattern": "^[0-9a-f]{64}$" }
      }
    },
    "summary": { "type": "string", "minLength": 1 },
    "stages": {
      "type": "object",
      "additionalProperties": false,
      "required": ["general", "deep"],
      "properties": {
        "general": { "$ref": "#/$defs/stage" },
        "deep": { "$ref": "#/$defs/stage" }
      }
    },
    "pr_split": {
      "type": "object",
      "additionalProperties": false,
      "required": ["status", "summary"],
      "properties": {
        "status": { "enum": ["analyzing", "recommended", "keep_together", "incomplete"] },
        "summary": { "type": "string", "minLength": 1 },
        "parts": {
          "type": "object",
          "minProperties": 2,
          "propertyNames": { "pattern": "^[A-Z][A-Z0-9]*$" },
          "additionalProperties": {
            "type": "object",
            "additionalProperties": false,
            "required": ["title", "scope", "validation", "depends_on"],
            "properties": {
              "title": { "type": "string", "minLength": 1 },
              "scope": { "type": "string", "minLength": 1 },
              "validation": { "type": "string", "minLength": 1 },
              "depends_on": {
                "type": "array",
                "uniqueItems": true,
                "items": { "type": "string", "pattern": "^[A-Z][A-Z0-9]*$" }
              }
            }
          }
        },
        "submission": { "enum": ["upstream", "fork", "unknown"] },
        "access": { "type": "string", "minLength": 1 }
      },
      "allOf": [
        {
          "if": { "properties": { "status": { "const": "recommended" } } },
          "then": { "required": ["parts", "submission", "access"] },
          "else": { "properties": { "parts": false, "submission": false, "access": false } }
        }
      ]
    },
    "pr_comparison": {
      "type": "object",
      "additionalProperties": false,
      "required": ["status", "summary"],
      "properties": {
        "status": { "enum": ["analyzing", "recommended", "no_action", "incomplete"] },
        "summary": { "type": "string", "minLength": 1 },
        "related_prs": {
          "type": "array",
          "minItems": 1,
          "items": {
            "type": "object",
            "additionalProperties": false,
            "required": ["url", "head_sha", "base_ref", "merge_base_sha"],
            "properties": {
              "url": { "type": "string", "pattern": "^https?://" },
              "head_sha": { "type": "string", "pattern": "^[0-9a-f]{40}$" },
              "base_ref": { "type": "string", "minLength": 1 },
              "merge_base_sha": { "type": "string", "pattern": "^[0-9a-f]{40}$" }
            }
          }
        },
        "implementation": { "type": "string", "minLength": 1 },
        "changes": { "type": "string", "minLength": 1 },
        "merge_order": { "type": "string", "minLength": 1 },
        "evidence": { "type": "string", "minLength": 1 }
      },
      "allOf": [
        {
          "if": { "properties": { "status": { "const": "recommended" } } },
          "then": {
            "required": ["related_prs", "implementation", "changes", "merge_order", "evidence"]
          },
          "else": {
            "properties": {
              "implementation": false,
              "changes": false,
              "merge_order": false,
              "evidence": false
            }
          }
        }
      ]
    },
    "simplification": {
      "type": "object",
      "additionalProperties": false,
      "minProperties": 1,
      "properties": {
        "production": { "$ref": "#/$defs/necessityAudit" },
        "tests": { "$ref": "#/$defs/necessityAudit" }
      }
    },
    "scope": {
      "type": "object",
      "minProperties": 1,
      "maxProperties": 1,
      "propertyNames": { "pattern": "^[0-9a-f]{64}$" },
      "additionalProperties": {
        "type": "object",
        "additionalProperties": false,
        "required": ["inventory_id", "counts", "groups"],
        "properties": {
          "inventory_id": { "type": "string", "pattern": "^[0-9a-f]{64}$" },
          "path_encoding": { "enum": ["utf-8", "percent"] },
          "counts": {
            "type": "object",
            "additionalProperties": false,
            "required": ["accept", "relocate", "clarify"],
            "properties": {
              "accept": { "type": "integer", "minimum": 0 },
              "relocate": { "type": "integer", "minimum": 0 },
              "clarify": { "type": "integer", "minimum": 0 }
            }
          },
          "groups": { "type": "array", "items": { "$ref": "#/$defs/scopeGroup" } }
        }
      }
    },
    "findings": {
      "type": "object",
      "additionalProperties": { "$ref": "#/$defs/finding" }
    },
    "ci": {
      "type": "object",
      "additionalProperties": false,
      "required": ["source", "snapshot_fingerprint", "status", "failures"],
      "properties": {
        "source": {
          "type": "object",
          "additionalProperties": false,
          "required": ["head_sha"],
          "properties": { "head_sha": { "type": "string", "pattern": "^[0-9a-f]{40}$" } }
        },
        "snapshot_fingerprint": { "type": "string", "pattern": "^[0-9a-f]{64}$" },
        "status": { "enum": ["analyzing", "completed", "incomplete"] },
        "failures": {
          "type": "object",
          "minProperties": 1,
          "propertyNames": { "minLength": 1 },
          "additionalProperties": { "$ref": "#/$defs/ciFailure" }
        }
      },
      "allOf": [
        {
          "if": { "properties": { "status": { "const": "completed" } } },
          "then": {
            "properties": {
              "failures": { "additionalProperties": { "required": ["evidence", "next_step"] } }
            }
          }
        }
      ]
    },
    "disclosure": {
      "type": "string",
      "minLength": 1,
      "pattern": "^Powered by Nyanpasu with ",
      "description": "Plain text inside the current turn's disclosure footer; no HTML or Markdown. The template links the Nyanpasu name."
    }
  },
  "allOf": [
    {
      "if": { "properties": { "status": { "const": "not_reviewed" } } },
      "then": {
        "properties": {
          "findings": { "maxProperties": 0 },
          "scope": false,
          "simplification": false,
          "pr_split": false,
          "pr_comparison": false,
          "stages": {
            "properties": {
              "general": { "properties": { "status": { "const": "pending" } } },
              "deep": { "properties": { "status": { "const": "pending" } } }
            }
          }
        }
      },
      "else": {
        "properties": {
          "source": { "required": ["merge_base_sha", "inventory_id"] },
          "stages": {
            "properties": {
              "general": {
                "properties": { "status": { "enum": ["running", "completed", "incomplete"] } }
              }
            }
          }
        }
      }
    },
    {
      "if": { "properties": { "status": { "const": "preliminary" } } },
      "then": {
        "required": ["stages"],
        "properties": {
          "stages": {
            "properties": {
              "general": { "properties": { "status": { "const": "completed" } } },
              "deep": { "properties": { "status": { "enum": ["pending", "running"] } } }
            }
          }
        }
      }
    },
    {
      "if": {
        "properties": { "status": { "enum": ["approved", "comment", "changes_requested"] } }
      },
      "then": {
        "properties": {
          "stages": {
            "properties": {
              "general": { "properties": { "status": { "const": "completed" } } },
              "deep": { "properties": { "status": { "enum": ["completed", "skipped"] } } }
            }
          }
        }
      }
    },
    {
      "if": { "properties": { "status": { "const": "changes_requested" } } },
      "then": {
        "properties": {
          "findings": {
            "description": "Requesting changes requires an unresolved or partially resolved P1 finding.",
            "not": {
              "additionalProperties": {
                "anyOf": [
                  { "properties": { "priority": { "enum": ["P0", "P2", "P3"] } } },
                  { "properties": { "status": { "enum": ["resolved", "superseded"] } } }
                ]
              }
            }
          }
        }
      }
    },
    {
      "if": { "properties": { "status": { "const": "approved" } } },
      "then": {
        "properties": {
          "findings": {
            "additionalProperties": {
              "properties": { "status": { "enum": ["resolved", "superseded"] } }
            }
          }
        }
      }
    },
    {
      "if": { "properties": { "status": { "const": "approved" } } },
      "then": {
        "required": ["scope"],
        "properties": {
          "scope": {
            "additionalProperties": {
              "properties": {
                "counts": {
                  "properties": { "relocate": { "const": 0 }, "clarify": { "const": 0 } }
                },
                "groups": { "items": { "properties": { "decision": { "const": "accept" } } } }
              }
            }
          }
        }
      }
    }
  ],
  "$defs": {
    "ciFailure": {
      "type": "object",
      "additionalProperties": false,
      "required": ["name", "url", "conclusion", "tested_sha", "summary"],
      "properties": {
        "name": { "type": "string", "minLength": 1 },
        "url": { "type": "string", "pattern": "^https?://" },
        "conclusion": {
          "enum": ["failure", "error", "timed_out", "action_required", "startup_failure"]
        },
        "tested_sha": { "type": "string", "pattern": "^[0-9a-f]{40}$" },
        "run_id": { "type": "integer", "minimum": 1 },
        "run_attempt": { "type": "integer", "minimum": 1 },
        "summary": { "type": "string", "minLength": 1 },
        "evidence": { "type": "string", "minLength": 1 },
        "next_step": { "type": "string", "minLength": 1 }
      }
    },
    "scopeGroup": {
      "additionalProperties": false,
      "properties": {
        "files": {
          "items": { "type": "string" },
          "minItems": 1,
          "title": "Files",
          "type": "array"
        },
        "category": {
          "enum": ["production", "tests", "examples", "evidence", "generated", "vendor", "other"],
          "title": "Category",
          "type": "string"
        },
        "decision": {
          "enum": ["accept", "relocate", "clarify"],
          "title": "Decision",
          "type": "string"
        },
        "reason": { "pattern": "\\S", "title": "Reason", "type": "string" },
        "source": { "pattern": "\\S", "title": "Source", "type": "string" },
        "alternative": { "pattern": "\\S", "title": "Alternative", "type": "string" }
      },
      "required": ["files", "category", "decision", "reason", "source", "alternative"],
      "title": "ScopeGroup",
      "type": "object"
    },
    "necessityAudit": {
      "type": "object",
      "additionalProperties": false,
      "required": ["status", "summary", "entries"],
      "properties": {
        "status": {
          "enum": ["pending", "running", "recommended", "completed", "skipped", "incomplete"]
        },
        "summary": {
          "type": "string",
          "minLength": 1,
          "description": "Checked scope and outcome, outstanding gaps, or a concrete reason no scope applies."
        },
        "entries": { "type": "array", "items": { "$ref": "#/$defs/necessityDecision" } }
      },
      "allOf": [
        {
          "if": { "properties": { "status": { "enum": ["recommended", "completed"] } } },
          "then": { "properties": { "entries": { "minItems": 1 } } }
        },
        {
          "if": { "properties": { "status": { "const": "recommended" } } },
          "then": {
            "properties": {
              "entries": {
                "items": {
                  "properties": { "decision": { "enum": ["remove", "merge", "replace"] } }
                }
              }
            }
          },
          "else": {
            "properties": {
              "entries": { "items": { "properties": { "decision": { "const": "retain" } } } }
            }
          }
        },
        {
          "if": { "properties": { "status": { "const": "skipped" } } },
          "then": { "properties": { "entries": { "maxItems": 0 } } }
        }
      ]
    },
    "necessityDecision": {
      "type": "object",
      "additionalProperties": false,
      "required": ["scope", "contract", "alternative", "decision", "evidence"],
      "properties": {
        "scope": { "type": "string", "minLength": 1 },
        "contract": { "type": "string", "minLength": 1 },
        "alternative": { "type": "string", "minLength": 1 },
        "decision": { "enum": ["remove", "merge", "replace", "retain"] },
        "evidence": { "type": "string", "minLength": 1 }
      }
    },
    "stage": {
      "type": "object",
      "additionalProperties": false,
      "required": ["status", "summary"],
      "properties": {
        "status": { "enum": ["pending", "running", "completed", "skipped", "incomplete"] },
        "summary": { "type": "string", "minLength": 1 }
      }
    },
    "finding": {
      "type": "object",
      "additionalProperties": false,
      "required": ["title", "url", "priority", "status"],
      "allOf": [
        {
          "if": { "required": ["kind"], "properties": { "kind": { "const": "simplification" } } },
          "then": { "properties": { "priority": { "enum": ["P2", "P3"] } } }
        }
      ],
      "properties": {
        "title": { "type": "string", "minLength": 1 },
        "url": { "type": "string", "pattern": "^https?://" },
        "priority": {
          "enum": ["P0", "P1", "P2", "P3"],
          "description": "Use P1/P2/P3 for new findings. P0 is a legacy alias accepted for old dashboard data and rendered as High."
        },
        "kind": { "enum": ["correctness", "simplification"] },
        "status": { "enum": ["unresolved", "partial", "resolved", "superseded"] },
        "rule": {
          "type": "object",
          "additionalProperties": false,
          "required": ["title", "url"],
          "properties": {
            "title": { "type": "string", "minLength": 1 },
            "url": { "type": "string", "pattern": "^https?://" }
          }
        }
      }
    }
  }
}
